{
  "product": "moqui-poc",
  "module": "governance-platform",
  "page": "screen-explorer-workbench",
  "entity": "Screen",
  "scene_id": "sce.scene--platform-screen-explorer-assist--0.1.0",
  "workflow_node": "screen-analysis",
  "fields": [
    {
      "name": "screen_name",
      "type": "string",
      "sensitive": false
    },
    {
      "name": "component_type",
      "type": "enum",
      "sensitive": false
    },
    {
      "name": "api_token",
      "type": "string",
      "sensitive": true
    }
  ],
  "current_state": {
    "screen_name": "Screen Explorer",
    "component_type": "Entity",
    "api_token": "tok_live_example_abc",
    "operator": "platform_manager"
  },
  "scene_workspace": {
    "scene_name": "Screen 探索场景",
    "scene_type": "screen-analysis",
    "screen_explorer": {
      "active_tab": "Overview",
      "selected_screen": "Screen Explorer",
      "selected_component": "Entity",
      "filters": [
        "AI Components",
        "Forms",
        "Widgets"
      ],
      "result_total": 0
    },
    "ontology": {
      "entities": [
        "Screen",
        "Form",
        "Widget"
      ],
      "relations": [
        "Screen_has_Form",
        "Screen_has_Widget"
      ],
      "business_rules": [
        "screen_name_unique",
        "component_reference_consistency",
        "change_requires_audit_record"
      ],
      "decision_policies": [
        "publish_requires_risk_review",
        "fallback_to_read_only_when_gate_non_allow"
      ]
    }
  },
  "assistant_panel": {
    "session_id": "session-1771",
    "agent_id": "codex-gpt4-1",
    "model": "Spec-Expert",
    "mode": "read-only",
    "current_page_context": "Ask what should be fixed on the current page and propose actionable plan."
  }
}
